{
  "kind": "experience_coverage",
  "schema_version": 1,
  "description": "Canonical persona, journey, user-story, flow, screen, component and diagram coverage for the complete PenniLogic Android, customer-web and admin products. Records are planning contracts and use synthetic data only.",
  "required_states": ["empty", "loading", "error", "offline", "stale", "permission-denied", "quota-exceeded", "degraded", "success", "partial", "conflict", "revoked", "destructive", "overflow", "recovery"],
  "component_states": ["default", "hover", "focus", "active", "pressed", "selected", "disabled", "empty", "loading", "error", "offline", "stale", "permission-denied", "quota-exceeded", "degraded", "success", "partial", "conflict", "revoked", "destructive", "overflow", "redacted", "unconfirmed"],
  "frontend_tickets": [
    "android#1", "android#2", "android#3", "android#4", "android#5", "android#9", "android#10", "android#11", "android#12",
    "T-AUTH-02", "T-AND-01", "T-AND-02", "T-AND-03", "T-AND-04", "T-AND-05", "T-AND-06", "T-AND-08",
    "T-NOT-02", "T-NOT-04", "T-TRU-01", "T-TRU-02", "T-TRU-04", "T-TRU-05", "T-ING-01", "T-ING-02", "T-ING-04", "T-TXN-02",
    "T-NWT-02", "T-NWT-05", "T-INC-03", "T-GOL-02", "T-SPL-02", "T-FAM-03", "T-FAM-06", "T-AIP-03", "T-BIL-03", "T-SUP-02", "T-CMP-02", "T-GLO-02", "T-GLO-04", "T-RET-01", "T-DEBT-04",
    "T-WEB-01", "T-WEB-02", "T-WEB-03", "T-WEB-04", "T-WEB-05", "T-DEBT-05", "T-NWT-03", "T-NWT-06", "T-INC-04", "T-GOL-03", "T-SPL-04", "T-FAM-04", "T-FAM-07", "T-AIP-04", "T-BIL-09", "T-TRU-03", "T-SUP-03", "T-NOT-03", "T-GLO-03",
    "T-ADM-04", "T-ADM-07", "T-ADM-08", "T-ADM-09", "T-ADM-10", "T-ADM-11", "T-ADM-12", "T-ADM-13", "T-ADM-14", "T-ADM-15", "T-ADM-16", "T-ADM-17", "T-ADM-18"
  ],
  "personas": [
    { "id": "P01", "name": "Debt-focused salaried adult", "jobs": ["Understand payoff status and choose a feasible debt strategy"], "platforms": ["android", "web"], "owner_ticket": "T-UXR-03" },
    { "id": "P02", "name": "Irregular-income household contributor", "jobs": ["Stabilize spending and make progress despite variable income"], "platforms": ["android", "web"], "owner_ticket": "T-UXR-03" },
    { "id": "P03", "name": "Manual privacy-first user", "jobs": ["Track money and plan debt without granting capture permissions"], "platforms": ["android", "web"], "owner_ticket": "T-UXR-03" },
    { "id": "P04", "name": "Automation-seeking Android user", "jobs": ["Capture transactions and resolve only genuine ambiguity"], "platforms": ["android"], "owner_ticket": "T-UXR-03" },
    { "id": "P05", "name": "Financial planner and large-screen power user", "jobs": ["Import, bulk-correct, analyze and compare financial scenarios"], "platforms": ["web"], "owner_ticket": "T-UXR-03" },
    { "id": "P06", "name": "Household owner", "jobs": ["Share selected information and coordinate a joint goal"], "platforms": ["android", "web"], "owner_ticket": "T-UXR-03" },
    { "id": "P07", "name": "Household member needing safe exit", "jobs": ["Understand access and revoke, leave or conceal safely"], "platforms": ["android", "web"], "owner_ticket": "T-UXR-03" },
    { "id": "P08", "name": "Split organizer or participant", "jobs": ["Allocate, dispute and settle temporary group expenses fairly"], "platforms": ["android", "web"], "owner_ticket": "T-UXR-03" },
    { "id": "P09", "name": "AI-assisted user", "jobs": ["Obtain explanations while retaining provenance and control"], "platforms": ["android", "web"], "owner_ticket": "T-UXR-03" },
    { "id": "P10", "name": "Support and privacy operator", "jobs": ["Resolve customer and rights requests within required clocks"], "platforms": ["admin"], "owner_ticket": "T-UXR-03" },
    { "id": "P11", "name": "Security and compliance approver", "jobs": ["Review high-risk access, audit and incident actions safely"], "platforms": ["admin"], "owner_ticket": "T-UXR-03" },
    { "id": "P12", "name": "Billing and AI operations manager", "jobs": ["Change plans, quotas and providers without silent customer harm"], "platforms": ["admin"], "owner_ticket": "T-UXR-03" }
  ],
  "journeys": [
    { "id": "J01", "name": "First run to first debt-free status", "persona_ids": ["P01", "P03", "P04"], "flow_ids": ["F-AND-01", "F-AND-02", "F-AND-03", "F-AND-04", "F-AND-16", "F-WEB-01", "F-WEB-03"], "critical": true, "owner_ticket": "T-UXR-04" },
    { "id": "J02", "name": "Authentication, recovery and trusted return", "persona_ids": ["P01", "P03", "P05"], "flow_ids": ["F-AND-02", "F-WEB-01"], "critical": true, "owner_ticket": "T-UXR-04" },
    { "id": "J03", "name": "Capture to trusted corrected transaction", "persona_ids": ["P03", "P04"], "flow_ids": ["F-AND-03", "F-AND-06", "F-AND-07", "F-AND-08", "F-WEB-02", "F-WEB-05"], "critical": true, "owner_ticket": "T-UXR-04" },
    { "id": "J04", "name": "Debt strategy and scenario decision", "persona_ids": ["P01", "P05"], "flow_ids": ["F-AND-04", "F-AND-05", "F-WEB-03", "F-WEB-04"], "critical": true, "owner_ticket": "T-UXR-04" },
    { "id": "J05", "name": "Income, budget, goal and net-worth planning", "persona_ids": ["P01", "P02", "P05"], "flow_ids": ["F-AND-09", "F-AND-10", "F-AND-16", "F-WEB-06", "F-WEB-12"], "critical": true, "owner_ticket": "T-UXR-04" },
    { "id": "J06", "name": "Split group from invite to settlement", "persona_ids": ["P08"], "flow_ids": ["F-AND-11", "F-WEB-07"], "critical": true, "owner_ticket": "T-UXR-04" },
    { "id": "J07", "name": "Household grant, joint goal and safe exit", "persona_ids": ["P06", "P07"], "flow_ids": ["F-AND-12", "F-WEB-08"], "critical": true, "owner_ticket": "T-UXR-04" },
    { "id": "J08", "name": "Assistant explanation and controlled action", "persona_ids": ["P09"], "flow_ids": ["F-AND-13", "F-WEB-09"], "critical": true, "owner_ticket": "T-UXR-04" },
    { "id": "J09", "name": "Subscription, notification and retention control", "persona_ids": ["P01", "P02", "P09"], "flow_ids": ["F-AND-14", "F-WEB-10"], "critical": true, "owner_ticket": "T-UXR-04" },
    { "id": "J10", "name": "Trust, rights and support", "persona_ids": ["P03", "P07", "P10"], "flow_ids": ["F-AND-15", "F-WEB-11", "F-ADM-06", "F-ADM-07"], "critical": true, "owner_ticket": "T-UXR-04" },
    { "id": "J11", "name": "Operator access and compliance fulfillment", "persona_ids": ["P10", "P11"], "flow_ids": ["F-ADM-01", "F-ADM-02", "F-ADM-03", "F-ADM-07", "F-ADM-09"], "critical": true, "owner_ticket": "T-UXR-04" },
    { "id": "J12", "name": "System configuration, audit and release operations", "persona_ids": ["P11", "P12"], "flow_ids": ["F-ADM-04", "F-ADM-05", "F-ADM-08", "F-ADM-10"], "critical": true, "owner_ticket": "T-UXR-04" }
  ],
  "user_stories": [
    { "id": "US-AND-01", "platform": "android", "as_a": "debt-focused Android user", "i_want": "a safe launch, lock and adaptive shell", "so_that": "I can return to my finances without exposing private data", "persona_ids": ["P01", "P03", "P04"], "journey_ids": ["J01"], "flow_id": "F-AND-01", "owner_ticket": "T-UXA-01" },
    { "id": "US-AND-02", "platform": "android", "as_a": "returning Android user", "i_want": "accessible authentication and account recovery", "so_that": "I can regain access without weakening account security", "persona_ids": ["P01", "P03"], "journey_ids": ["J01", "J02"], "flow_id": "F-AND-02", "owner_ticket": "T-UXA-02" },
    { "id": "US-AND-03", "platform": "android", "as_a": "privacy-conscious Android user", "i_want": "clear consent, age and permission choices", "so_that": "I can use manual paths and grant only what I understand", "persona_ids": ["P03", "P04"], "journey_ids": ["J01", "J03"], "flow_id": "F-AND-03", "owner_ticket": "T-UXA-02" },
    { "id": "US-AND-04", "platform": "android", "as_a": "person working to become debt free", "i_want": "a trustworthy home and debt management flow", "so_that": "I can see progress and take the next feasible action", "persona_ids": ["P01"], "journey_ids": ["J01", "J04"], "flow_id": "F-AND-04", "owner_ticket": "T-UXA-03" },
    { "id": "US-AND-05", "platform": "android", "as_a": "person comparing debt strategies", "i_want": "neutral advanced scenarios with derivations", "so_that": "I can choose a strategy without mistaking projections for guarantees", "persona_ids": ["P01"], "journey_ids": ["J04"], "flow_id": "F-AND-05", "owner_ticket": "T-UXA-04" },
    { "id": "US-AND-06", "platform": "android", "as_a": "person tracking daily money", "i_want": "accounts, transactions and statement import", "so_that": "I can build a correct record and safely resolve conflicts", "persona_ids": ["P03", "P04"], "journey_ids": ["J03"], "flow_id": "F-AND-06", "owner_ticket": "T-UXA-05" },
    { "id": "US-AND-07", "platform": "android", "as_a": "person using automatic capture", "i_want": "capture health and focused clarification", "so_that": "I can correct uncertainty without approving guesses", "persona_ids": ["P03", "P04"], "journey_ids": ["J03"], "flow_id": "F-AND-07", "owner_ticket": "T-UXA-06" },
    { "id": "US-AND-08", "platform": "android", "as_a": "person importing email or receipt evidence", "i_want": "a local-first capture review flow", "so_that": "I can add transactions without raw content leaving my device", "persona_ids": ["P03", "P04"], "journey_ids": ["J03"], "flow_id": "F-AND-08", "owner_ticket": "T-UXA-06" },
    { "id": "US-AND-09", "platform": "android", "as_a": "person with regular or irregular income", "i_want": "income, budget and recurring planning", "so_that": "I can plan realistic commitments as my income changes", "persona_ids": ["P01", "P02"], "journey_ids": ["J05"], "flow_id": "F-AND-09", "owner_ticket": "T-UXA-07" },
    { "id": "US-AND-10", "platform": "android", "as_a": "person planning long-term finances", "i_want": "goals, net worth, holdings and reports", "so_that": "I can understand progress without mixing currencies or certainty", "persona_ids": ["P01", "P02"], "journey_ids": ["J05"], "flow_id": "F-AND-10", "owner_ticket": "T-UXA-08" },